rank,topic,size,share,sentiment,segment,unmet_need,research_question,opportunity_score,top_keywords,example_quote
1,No guided on-ramp into a new genre,59,0.322,mixed,Aspirational explorer,"Staged, goal-based exploration that coaches you into a genre",Q3 listening behaviours users want,35.4,new; genre; actually; song; artist; music,As an aspirational explorer I save tons of new music and forget all of it. Retention and rotation are the real unmet need.
2,Stuck in a listening loop / same songs on repeat,12,0.066,negative,Time-poor (busy parent),Gentle nudges that expand the rotation without losing comfort,Q4 repeat-listening of the same content,12.0,songs; repeat; songs repeat; stuck; loop; app,The same 50 songs on repeat problem is so real. I love them but I'm in a loop and the app does nothing to gently expand it.
3,New music never sticks (discovery without adoption),44,0.24,positive,Time-poor (busy parent),Reinforcement that converts a first play into a lasting habit,"Q4 / core: adoption, not one-off plays",11.0,music; spotify; new; discovery; just; users,I have ADHD and the firehose of new releases is completely overwhelming. Discovery is way too high-effort to keep up with.
4,Discovery surfaces don't lead anywhere new,26,0.142,positive,Aspirational explorer,Discovery that introduces artists you'd never have found yourself,Q1 why discovery struggles,6.5,week; discover; weekly; discover weekly; artists; playlist,I'd love a guided on-ramp to get into classical. Stage it for me week by week instead of one giant intimidating playlist.
5,Recommendations lack a 'why',25,0.137,positive,Aspirational explorer,A clear bridge explaining why a track fits your existing taste,Q2 recommendation frustrations,6.25,app; spotify; songs; recommend; albums; ads,"Your Episodes, Remove finished episodes after playing doesn't work. Thanks for the script recommendation, going to give that a try"
6,Users want control over adventurousness,17,0.093,positive,Power digger,A comfort-to-curiosity control over how far recommendations stretch,Q2 recommendation frustrations,4.25,love; want; recommendations; safe; algorithm; artists,A comfort-to-curiosity dial is genius. The biggest gap in every recommender is control over how far the recs stretch.
