rank,topic,size,share,sentiment,segment,unmet_need,research_question,opportunity_score,top_keywords,example_quote
1,No guided on-ramp into a new genre,96,0.522,mixed,Power digger,"Staged, goal-based exploration that coaches you into a genre",Q3 listening behaviours users want,57.6,new; want; actually; genre; recommendations; love,"DJ sucks. Love the recommendation algorithm in ""DJ"", but hate the ai dj. Would love it if we had the option to turn him off"
2,Stuck in a listening loop / same songs on repeat,21,0.114,negative,Time-poor (busy parent),Gentle nudges that expand the rotation without losing comfort,Q4 repeat-listening of the same content,21.0,want; songs; comfort; repeat; days; loop,As a busy parent with two kids I have no time or energy to crate dig. I just want low-effort discovery that comes to me.
3,Recommendations lack a 'why',17,0.092,negative,Aspirational explorer,A clear bridge explaining why a track fits your existing taste,Q2 recommendation frustrations,17.0,trust; shuffle; like; recommendations; app; recommendation,"Honestly when a recommendation explains why a track fits my taste, I trust it so much more. The 'why' is everything."
4,New music never sticks (discovery without adoption),17,0.092,mixed,Aspirational explorer,Reinforcement that converts a first play into a lasting habit,"Q4 / core: adoption, not one-off plays",10.2,new; artists; radar; release; rotation; discovery,As an aspirational explorer I save tons of new music and forget all of it. Retention and rotation are the real unmet need.
5,Discovery surfaces don't lead anywhere new,33,0.179,positive,Aspirational explorer,Discovery that introduces artists you'd never have found yourself,Q1 why discovery struggles,8.25,discover; weekly; discover weekly; week; artists; playlist,discover weekly used to find me artists i'd never have found myself. now it's all safe picks i already know. discovery is broken
