rank,topic,size,share,sentiment,segment,unmet_need,research_question,opportunity_score,top_keywords,example_quote
1,Stuck in a listening loop / same songs on repeat,45,0.239,mixed,Time-poor (busy parent),Gentle nudges that expand the rotation without losing comfort,Q4 repeat-listening of the same content,27.0,music; app; songs; love; ads; recommendation,The same 50 songs on repeat problem is so real. I love them but I'm in a loop and the app does nothing to gently expand it.
2,Users want control over adventurousness,18,0.096,negative,Power digger,A comfort-to-curiosity control over how far recommendations stretch,Q2 recommendation frustrations,18.0,recommendations; want; safe; algorithm; days; days want,A comfort-to-curiosity dial is genius. The biggest gap in every recommender is control over how far the recs stretch.
3,No guided on-ramp into a new genre,70,0.372,positive,Aspirational explorer,"Staged, goal-based exploration that coaches you into a genre",Q3 listening behaviours users want,17.5,spotify; playlist; music; songs; song; playlists,The killer feature would be adoption tracking. Most discovery never converts into a lasting habit a first play is not a win.
4,Discovery surfaces don't lead anywhere new,30,0.16,positive,Aspirational explorer,Discovery that introduces artists you'd never have found yourself,Q1 why discovery struggles,7.5,discover; weekly; discover weekly; week; artists; playlist,I'd love a guided on-ramp to get into classical. Stage it for me week by week instead of one giant intimidating playlist.
5,New music never sticks (discovery without adoption),25,0.133,positive,Aspirational explorer,Reinforcement that converts a first play into a lasting habit,"Q4 / core: adoption, not one-off plays",6.25,new; just; discovery; music; want; effort,I have ADHD and the firehose of new releases is completely overwhelming. Discovery is way too high-effort to keep up with.
