rank,topic,size,share,sentiment,segment,unmet_need,research_question,opportunity_score,top_keywords,example_quote
1,New music never sticks (discovery without adoption),27,0.141,negative,Aspirational explorer,Reinforcement that converts a first play into a lasting habit,"Q4 / core: adoption, not one-off plays",27.0,new; artist; actually; song; discovery; genre,I have ADHD and the firehose of new releases is completely overwhelming. Discovery is way too high-effort to keep up with.
2,No guided on-ramp into a new genre,102,0.534,positive,Time-poor (busy parent),"Staged, goal-based exploration that coaches you into a genre",Q3 listening behaviours users want,25.5,music; new; songs; like; spotify; playlists,"Sure, it's behind a pay wall, but it absolutely works like a music app should work. The artists do have to make their money too!"
3,Stuck in a listening loop / same songs on repeat,12,0.063,negative,Time-poor (busy parent),Gentle nudges that expand the rotation without losing comfort,Q4 repeat-listening of the same content,12.0,songs; loop; stuck; repeat; rut; songs repeat,The same 50 songs on repeat problem is so real. I love them but I'm in a loop and the app does nothing to gently expand it.
4,Discovery surfaces don't lead anywhere new,37,0.194,positive,Aspirational explorer,Discovery that introduces artists you'd never have found yourself,Q1 why discovery struggles,9.25,discover; week; weekly; discover weekly; playlist; artists,I'd love a guided on-ramp to get into classical. Stage it for me week by week instead of one giant intimidating playlist.
5,Users want control over adventurousness,13,0.068,mixed,Power digger,A comfort-to-curiosity control over how far recommendations stretch,Q2 recommendation frustrations,7.8,want; algorithm; days; days want; artists; deep,A comfort-to-curiosity dial is genius. The biggest gap in every recommender is control over how far the recs stretch.
