rank,topic,size,share,sentiment,segment,unmet_need,research_question,opportunity_score,top_keywords,example_quote
1,Stuck in a listening loop / same songs on repeat,43,0.224,negative,Aspirational explorer,Gentle nudges that expand the rotation without losing comfort,Q4 repeat-listening of the same content,43.0,playlist; songs; app; play; playlists; stuck,The same 50 songs on repeat problem is so real. I love them but I'm in a loop and the app does nothing to gently expand it.
2,New music never sticks (discovery without adoption),13,0.068,negative,Aspirational explorer,Reinforcement that converts a first play into a lasting habit,"Q4 / core: adoption, not one-off plays",13.0,week; new; forget; sticks; save; songs,I'd love a guided on-ramp to get into classical. Stage it for me week by week instead of one giant intimidating playlist.
3,No guided on-ramp into a new genre,46,0.24,positive,Aspirational explorer,"Staged, goal-based exploration that coaches you into a genre",Q3 listening behaviours users want,11.5,spotify; music; playlist; users; songs; playlists,I love spotify! All of my favorite music can be played on spotify. I definitely recommend installing spotify!!!!!
4,Users want control over adventurousness,35,0.182,positive,Power digger,A comfort-to-curiosity control over how far recommendations stretch,Q2 recommendation frustrations,8.75,want; new; music; songs; way; new music,"Please add a slider to control how adventurous the recommendations are. Some days I want comfort, some days a real stretch."
5,Recommendations recycle the familiar (echo chamber),7,0.036,negative,General listener,"Genuinely novel recommendations that expand taste, not reinforce it",Q2 recommendation frustrations,7.0,echo; chamber; echo chamber; artists; discovery; reinforces,The algorithm is an echo chamber. It reinforces what I already play instead of expanding my taste into new artists.
6,Discovery surfaces don't lead anywhere new,27,0.141,positive,Aspirational explorer,Discovery that introduces artists you'd never have found yourself,Q1 why discovery struggles,6.75,discover; weekly; discover weekly; artists; week; playlist,discover weekly used to find me artists i'd never have found myself. now it's all safe picks i already know. discovery is broken
7,Recommendations lack a 'why',21,0.109,positive,Time-poor (busy parent),A clear bridge explaining why a track fits your existing taste,Q2 recommendation frustrations,5.25,discovery; recommendations; new; trust; actually; like,As a busy parent with two kids I have no time or energy to crate dig. I just want low-effort discovery that comes to me.
